{
  "name": "approved-gs-unauthorized",
  "description": "gate GS refuses an Approved from outside the staging list and starts nothing",
  "config": {
    "approvers": {
      "release_scope": [
        "boss"
      ],
      "spec": [
        "boss"
      ],
      "design": [
        "boss"
      ],
      "implementation": [
        "boss"
      ],
      "expedite": [
        "boss"
      ],
      "staging": [
        "boss"
      ]
    }
  },
  "repo": {
    "issues": [
      {
        "number": 5,
        "title": "Epic",
        "labels": [
          "factory:epic-ready"
        ]
      }
    ]
  },
  "event": {
    "name": "issue_comment",
    "action": "created",
    "issue": 5,
    "comment": {
      "body": "Approved",
      "login": "dev",
      "authorAssociation": "COLLABORATOR"
    }
  },
  "expect": {
    "role": "none",
    "labels": {
      "5": {
        "has": [
          "factory:epic-ready"
        ]
      }
    },
    "comments": {
      "5": {
        "countAtLeast": 1,
        "contains": [
          "@boss",
          "gate GS"
        ]
      }
    }
  }
}
