{
  "name": "plan-release-on-requirement",
  "description": "Plan release typed on a requirement issue is answered with a pointer to its tracker",
  "config": {
    "approvers": {
      "release_scope": [
        "boss"
      ],
      "spec": [
        "boss"
      ],
      "design": [
        "boss"
      ],
      "implementation": [
        "boss"
      ]
    },
    "release": {
      "gating": "milestone",
      "approval": "human",
      "auto_create_release_issue": true,
      "exempt_labels": [
        "factory:fast-track"
      ]
    }
  },
  "repo": {
    "milestones": [
      {
        "number": 7,
        "title": "v0.4",
        "htmlUrl": "u"
      }
    ],
    "issues": [
      {
        "number": 1,
        "title": "release(7): v0.4",
        "labels": [
          "factory:release",
          "factory:release-planning"
        ],
        "authorType": "Bot",
        "milestone": 7
      },
      {
        "number": 5,
        "title": "Add renewals",
        "labels": [
          "factory:backlog"
        ],
        "milestone": 7
      }
    ]
  },
  "event": {
    "name": "issue_comment",
    "action": "created",
    "issue": 5,
    "comment": {
      "body": "Plan release",
      "login": "boss",
      "authorAssociation": "OWNER"
    }
  },
  "expect": {
    "role": "none",
    "comments": {
      "5": {
        "count": 1,
        "contains": [
          "#1",
          "release tracker"
        ]
      }
    }
  }
}
