{
  "name": "milestoned-in-flight-untouched",
  "description": "milestone changes never move an issue that is already past intake",
  "config": {
    "approvers": {
      "release_scope": [
        "boss"
      ],
      "spec": [
        "boss"
      ],
      "design": [
        "boss"
      ],
      "implementation": [
        "boss"
      ]
    },
    "release": {
      "gating": "milestone",
      "approval": "human",
      "auto_create_release_issue": true,
      "exempt_labels": [
        "factory:fast-track"
      ]
    }
  },
  "repo": {
    "milestones": [
      {
        "number": 7,
        "title": "v0.4",
        "htmlUrl": "u"
      }
    ],
    "issues": [
      {
        "number": 5,
        "title": "In flight",
        "labels": [
          "factory:design-approved"
        ],
        "milestone": 7
      }
    ]
  },
  "event": {
    "name": "issues",
    "action": "milestoned",
    "issue": 5,
    "milestone": 7
  },
  "expect": {
    "role": "none",
    "labels": {
      "5": {
        "has": [
          "factory:design-approved"
        ],
        "not": [
          "factory:backlog"
        ]
      }
    },
    "comments": {
      "5": {
        "count": 0
      }
    }
  }
}
