{
  "name": "approved-gs-starts-the-release",
  "description": "gate GS: a staging approver's Approved on an epic-ready epic starts the Release Manager",
  "config": {
    "approvers": {
      "release_scope": [
        "boss"
      ],
      "spec": [
        "boss"
      ],
      "design": [
        "boss"
      ],
      "implementation": [
        "boss"
      ],
      "expedite": [
        "boss"
      ],
      "staging": [
        "boss"
      ]
    }
  },
  "repo": {
    "issues": [
      {
        "number": 5,
        "title": "Epic",
        "labels": [
          "factory:epic-ready"
        ]
      }
    ]
  },
  "event": {
    "name": "issue_comment",
    "action": "created",
    "issue": 5,
    "comment": {
      "body": "Approved",
      "login": "boss",
      "authorAssociation": "OWNER"
    }
  },
  "expect": {
    "role": "release",
    "issues": [
      "5"
    ],
    "labels": {
      "5": {
        "has": [
          "factory:epic-ready"
        ]
      }
    }
  }
}
