{
  "name": "issue-opened-approved-release-straight-in",
  "description": "gating on, filed against an already-approved milestone: intake immediately",
  "config": {
    "approvers": {
      "release_scope": [
        "boss"
      ],
      "spec": [
        "boss"
      ],
      "design": [
        "boss"
      ],
      "implementation": [
        "boss"
      ]
    },
    "release": {
      "gating": "milestone",
      "approval": "human",
      "auto_create_release_issue": true,
      "exempt_labels": [
        "factory:fast-track"
      ]
    }
  },
  "repo": {
    "milestones": [
      {
        "number": 7,
        "title": "v0.4",
        "htmlUrl": "u"
      }
    ],
    "issues": [
      {
        "number": 1,
        "title": "release(7): v0.4",
        "labels": [
          "factory:release",
          "factory:release-approved"
        ],
        "authorType": "Bot",
        "milestone": 7
      },
      {
        "number": 5,
        "title": "Add renewals",
        "labels": [],
        "milestone": 7
      }
    ]
  },
  "event": {
    "name": "issues",
    "action": "opened",
    "issue": 5
  },
  "expect": {
    "role": "intake",
    "issues": [
      "5"
    ],
    "labels": {
      "5": {
        "has": [
          "factory:intake"
        ]
      }
    }
  }
}
